{"accountingStateDigest":"sha256:60489db1838a94555c09fb91134bcae010c40ee0c3311ea3ba136f9e52b77be8","completedTransitions":[{"accountingStateDigest":"sha256:00897f41b0db226e426f009838d7c76e1cc198b9a816067566902b4dbfa46a59","builderHandoffDigest":"sha256:e4d03a9e243760e883982f390a0a18eaedd76c099b4927fe42c7818f1fa39f0f","builderResultDigest":"sha256:ddf585ba6a0040c87d19654d2b2e8996c429b1c5c400bfe4bca8678c89b6d065","ledgerOrdinal":3,"publicationManifestDigest":"sha256:5e50b952ba46ab51e9c18ed2e21438ab130061d786fb0a0e852e1112dd36c463","subjectTransactionId":"c70e1829a7c6a2a8cb8cfc2383f8abf825ac5ea6","submissionInputDigest":"sha256:2ddd31b86fc71d6c8e62563bdee8210a6da58bf7cfcef67af5abbb2ab9362b67","topologyAlignmentDigest":"sha256:b75bbbe9479a65f1946bc2c68ea86e86b7f41cc54f4e19413f7def0b54cc9475","workBundleDigest":"sha256:442eef38ec3169e514905e5bd76ffccf2647001d6193db088cf2a610b592fa1b"},{"accountingStateDigest":"sha256:1e82a770eb595aff11766eb0243f092e8e85b820eb1e805669b0ac35dd108bf5","builderHandoffDigest":"sha256:d95b796d29f3ebfa5c893c89716582297466f59a736d720fbc886c0f65c9f350","builderResultDigest":"sha256:e922d6388eef15e54f2dfd427784d930a831d7d43ebe6e05ddcb1b94581c04c9","ledgerOrdinal":4,"publicationManifestDigest":"sha256:9f0316b26316df7b86b2d5ab35b39129f79d42c620d8087a0abb33054261f4b0","subjectTransactionId":"f236017c62c67ce4218c1f81ea34134f0954b556","submissionInputDigest":"sha256:392e697c9461e9b200de54b8ee01d83e02c8a4be808f9476e61f01559630e527","topologyAlignmentDigest":"sha256:b895bca3caeec45f724932b4a38ee02847015ef8e51c9fb535287c849bd5c6dd","workBundleDigest":"sha256:76974840aeccd0fdd75e47c552860289dcaed2fad7cd889c1309d1afb9438b89"},{"accountingStateDigest":"sha256:b6bc984a0eee08471fd8b96996a34888f46a18792fa27aea13df7d203e15fab5","builderHandoffDigest":"sha256:14b3f4a745cb0351f46202bf91bfd0d740fc74cd7c2b686538bef555a99f1331","builderResultDigest":"sha256:244b495423e70f5c46aed593c8a759782e1bc9344eb4f7e296ae009da0dcb806","ledgerOrdinal":5,"publicationManifestDigest":"sha256:e083802e7f9994839f74f105eab9906bdbd810afc37ad735d1d5db6cf7e85d18","subjectTransactionId":"14889884ae6ac1f80cc56485e7acf1b0b2cb6ae9","submissionInputDigest":"sha256:ab83a33f5db6e0c4999fa72e6624a6902af589f4227e3cc9658327ca104b8f13","topologyAlignmentDigest":"sha256:338c3d2183c3997c38e732578552b0a4e01206c7b08dd536d74820a9c24b8f7b","workBundleDigest":"sha256:67316c07029062585e5dd44aedc439f7eb11b8f710342f4aff3e146f63a6b431"},{"accountingStateDigest":"sha256:6963c0aa4e2538e5cf36151c9796b66019fe11b5424e14c0e2adb5822d79ffc1","builderHandoffDigest":"sha256:bc731885fee094b2edf981f6ee180555b18cfbc27b158e3b3853e689643721d8","builderResultDigest":"sha256:f37c561ee3313962f3898ac93029735c369873e41fe1ba48575b1e6af243d72c","ledgerOrdinal":9,"publicationManifestDigest":"sha256:b509ef3e723ad67e2f7944eabffd422062a16fe74406f71bbdaab34fb0ee9790","subjectTransactionId":"e3c1036ca607539a5ebcddf3058e6014ac5c1cd9","submissionInputDigest":"sha256:22868c2aa767eb08ed2ecbb4826ef3b26024e35278caaece6bbaa86c9c598de6","topologyAlignmentDigest":"sha256:7c1e14de900e28c062f90a9c75c6eb71bc50da29e8d3a4104485f53f38e4ea24","workBundleDigest":"sha256:ecd28cf9db408274c9b8805ce57b1078cbfe85b0f6f38a8cf6b1d07df413b4c6"},{"accountingStateDigest":"sha256:59bb30eab3f70e93cc94451c8838f5f4704c2de767cc4bb59b0b86a966fe311a","builderHandoffDigest":"sha256:188aa9b21df2b6f383394d63289a6be6c6220bcd150b05fb9421403794a5979f","builderResultDigest":"sha256:c1ff4fd67a74f08fed6be415694aabef94f031ab38c70779b63da906a9bfd10a","ledgerOrdinal":10,"publicationManifestDigest":"sha256:0cc02b5d00f2c0b9bd4c7af0ba352fb5eb07347e6a8e929bd93e52b5eedb5326","subjectTransactionId":"d2506be78c46f1799e9b54cfcb6eee17b984f0f1","submissionInputDigest":"sha256:a17b76a9fc8441b0f527c062e13b7252a0881326a3667780ad7ff15a1360e7a7","topologyAlignmentDigest":"sha256:84a7ba5588e4f6cc526630395e6f4d2aa50f652a266925e4629b6c07faa3647c","workBundleDigest":"sha256:43115bf950e7cdfd00d18af64b137a6661bcc231f1648aabf65e5c5cf7bc888c"},{"accountingStateDigest":"sha256:885f9c1075ee1a1ba56633553c36e019753754b14fc74f51ce7caff84bc0a2c5","builderHandoffDigest":"sha256:0360f89f1fccb3cc19af05265615fdf4e714000338b900ee0d9fbbf22fabcad6","builderResultDigest":"sha256:57d04ee44f90ebb797781808092c378dadd3b481522308f72bc0f8e4203306d9","ledgerOrdinal":11,"publicationManifestDigest":"sha256:355d843e2fe4d832720f78409dab86d556b13037b7975c8ae8852ab98cc78794","subjectTransactionId":"e2bbc1e210e496b3c834e658820fc90287f3b2c0","submissionInputDigest":"sha256:3aab72e446e78bf462e513f9982a15617e33100ddc3690b73256303aa3a28f4c","topologyAlignmentDigest":"sha256:a033d0a35bf06170326dcb581aebe4a2faa64e61fe49b4e58ca89c9c735f8789","workBundleDigest":"sha256:f21f285cbc497aef58b12504e3a03e9af0fb857683b4c4fff4530940a0ab8fe7"},{"accountingStateDigest":"sha256:60489db1838a94555c09fb91134bcae010c40ee0c3311ea3ba136f9e52b77be8","builderHandoffDigest":"sha256:59d6849d308f29938ee73cfe33e7e5d4279659fb4a9d0c7e6babdcfcdc2b9fa4","builderResultDigest":"sha256:845e47c0da1eea9642ce618490f84e6366a8eff19229d6682b954593b09f984a","ledgerOrdinal":12,"publicationManifestDigest":"sha256:564d7978b47a8184c77c1db83338c5dc43aa7edd9522e888c46be7101352b14c","subjectTransactionId":"1be513bb3d8f67f54e299ea0085cd2ef05144711","submissionInputDigest":"sha256:8d7561a07e6c3ea35694eb43292384757eff41b912063de7a81af7bed4dde86b","topologyAlignmentDigest":"sha256:4bc756ed26747ec0d27a126b1267911d011d8e8e3c10967e7942a76619b131ef","workBundleDigest":"sha256:8005ae5e41d584012ee44b18df9fe739f8a229220deb7d908b9b4dc1efcbfccd"}],"formedKnowledgeStateDigest":"sha256:38948e69ea259630786b4688beb93d0acaa5581a65fb63cb80210945be08affe","pendingTransition":{"afterKnowledgeStateDigest":"sha256:38948e69ea259630786b4688beb93d0acaa5581a65fb63cb80210945be08affe","beforeKnowledgeStateDigest":"sha256:82600b62e8c3e7f14be197a9577d402d73d41d205566ac4a8733b55ebb4e64e6","builderHandoffDigest":"sha256:9a21f82015cf79f2f7fb006ee53edb654c5c3aa34c44f5d8492d2897d4096477","builderResultDigest":"sha256:794750c95cf20d727b37212e77d750650e36250b45b334149445332fba2a583f","claimDigest":"sha256:4c07b5830ecdceed09abb15adc167b7457942dc1126322ac2f2adf0430bd34af","ledgerOrdinal":14,"nextAccountingStateDigest":"sha256:cb2e5212fd64212e417e535f18549840eb0a87274d696e1ee3260b9ac8a39ec6","nextScheduleDigest":"sha256:7b477c06a34c68cde1ec74e217373751adedb202b9085a615bed6c36901140f8","publicationManifestDigest":"sha256:21e5940f5b9a528de7690ac4d73ff7408c47c806d07cdba0b9fe8c5ad0929ec9","stage":"publication-prepared","subjectTransactionId":"b4f10336d43f1c31a11ecbc5f4eb94f1fca70e05","submissionInputDigest":"sha256:51c6c4fd598da6422700362976a829e7009d7e5956c1b394b5e8c317e2260f50","topologyAlignmentDigest":"sha256:6d3304ef3b007547820d266e5910f649dc9833b3f5256ba5a66e0b88686030fc","workBundleDigest":"sha256:8a7cb1698a0d39a3d9ca0fa21dc37e6f118f1b7cb093e143695c602411e46ca4"},"phase":"publication-prepared","pipelineStateDigest":"sha256:855d17b0bde6de7173c113f2ff386ea0b0fefcd9834dc66b18b15e897eef8a94","problemId":"bssc-sum-capacity","projectionId":"openrouter-work-accounting-v2","projectionSpecDigest":"sha256:a877110d86e4427f2f1ccd66f71bac2c78fd4cd0385e38b5090a4d39707a276a","rootContractDigest":"sha256:01d52a695e88694768973f3590c0c13eb5acd8070fbed32de8ad01e460c41135","scheduleDigest":"sha256:e0c435dc6b265b618177c692329781dd6948e38c74050d59783cdceca4df15db","schemaVersion":1}
