{"accountingStateDigest":"sha256:14d57e5d25ffce02309281e49955172e6ca136c529d58e4d2fd9344cdd45408c","completedTransitions":[{"accountingStateDigest":"sha256:766aab95ae1d88a757afce0077e89038041fe98945db5785ea8b71d598333dd6","builderHandoffDigest":"sha256:e4d03a9e243760e883982f390a0a18eaedd76c099b4927fe42c7818f1fa39f0f","builderResultDigest":"sha256:ddf585ba6a0040c87d19654d2b2e8996c429b1c5c400bfe4bca8678c89b6d065","ledgerOrdinal":3,"publicationManifestDigest":"sha256:51878b100d03cc408c233f31ff37f92587aaeba6e3f3dcc6976df2e0543bc1fd","subjectTransactionId":"c70e1829a7c6a2a8cb8cfc2383f8abf825ac5ea6","submissionInputDigest":"sha256:2ddd31b86fc71d6c8e62563bdee8210a6da58bf7cfcef67af5abbb2ab9362b67","topologyAlignmentDigest":"sha256:b75bbbe9479a65f1946bc2c68ea86e86b7f41cc54f4e19413f7def0b54cc9475","workBundleDigest":"sha256:bd0f8dc8c2df4bf52fc854bf38fb096559e87f06995102e6c44ee27ea6f28586"},{"accountingStateDigest":"sha256:5fe23d4603ddbd70bda515c8f87567ae2edcb332789958ff218fc629b083dead","builderHandoffDigest":"sha256:d95b796d29f3ebfa5c893c89716582297466f59a736d720fbc886c0f65c9f350","builderResultDigest":"sha256:e922d6388eef15e54f2dfd427784d930a831d7d43ebe6e05ddcb1b94581c04c9","ledgerOrdinal":4,"publicationManifestDigest":"sha256:09b637110847559cf0d8fa1d2a429fbfc24578bc93588e13aad56f960698371a","subjectTransactionId":"f236017c62c67ce4218c1f81ea34134f0954b556","submissionInputDigest":"sha256:392e697c9461e9b200de54b8ee01d83e02c8a4be808f9476e61f01559630e527","topologyAlignmentDigest":"sha256:b895bca3caeec45f724932b4a38ee02847015ef8e51c9fb535287c849bd5c6dd","workBundleDigest":"sha256:92a4cf87daaba092c7039aa48f3fb7fd272dccc50e99a5600f4880fd74c5fca1"},{"accountingStateDigest":"sha256:14d57e5d25ffce02309281e49955172e6ca136c529d58e4d2fd9344cdd45408c","builderHandoffDigest":"sha256:14b3f4a745cb0351f46202bf91bfd0d740fc74cd7c2b686538bef555a99f1331","builderResultDigest":"sha256:244b495423e70f5c46aed593c8a759782e1bc9344eb4f7e296ae009da0dcb806","ledgerOrdinal":5,"publicationManifestDigest":"sha256:a3f4d3ef8e92b7f7df9d079c13a618dadfe8bc527eda35a703e63c2c71c42bed","subjectTransactionId":"14889884ae6ac1f80cc56485e7acf1b0b2cb6ae9","submissionInputDigest":"sha256:ab83a33f5db6e0c4999fa72e6624a6902af589f4227e3cc9658327ca104b8f13","topologyAlignmentDigest":"sha256:338c3d2183c3997c38e732578552b0a4e01206c7b08dd536d74820a9c24b8f7b","workBundleDigest":"sha256:aa9f45e263e3b958a098327238f436e8cc3262524bda1905acc26d0a91f8b3f4"}],"formedKnowledgeStateDigest":"sha256:23f08472ba8526bb22ecb9fa1d9b8fbe4bb78ff554976a9bad3efa0f60bb784d","pendingTransition":{"afterKnowledgeStateDigest":"sha256:23f08472ba8526bb22ecb9fa1d9b8fbe4bb78ff554976a9bad3efa0f60bb784d","beforeKnowledgeStateDigest":"sha256:04d09ef748906bd0af20dfa0fa1f2749a940b911cdd2706a2cbcbb10bbe5a684","builderHandoffDigest":"sha256:bc731885fee094b2edf981f6ee180555b18cfbc27b158e3b3853e689643721d8","builderResultDigest":"sha256:f37c561ee3313962f3898ac93029735c369873e41fe1ba48575b1e6af243d72c","claimDigest":"sha256:0a72d2fac40a1cf384179d6e9a2c2b57fb854afb3eca0ee581bb97e93c104f74","ledgerOrdinal":9,"nextAccountingStateDigest":null,"nextScheduleDigest":null,"publicationManifestDigest":null,"stage":"awaiting-work","subjectTransactionId":"e3c1036ca607539a5ebcddf3058e6014ac5c1cd9","submissionInputDigest":"sha256:22868c2aa767eb08ed2ecbb4826ef3b26024e35278caaece6bbaa86c9c598de6","topologyAlignmentDigest":"sha256:7c1e14de900e28c062f90a9c75c6eb71bc50da29e8d3a4104485f53f38e4ea24","workBundleDigest":null},"phase":"awaiting-work","pipelineStateDigest":"sha256:a2d63f0b21dbea227c95ac4feb64ddc619fb43787f3b50c44854426f59ce4b98","problemId":"bssc-sum-capacity","projectionId":"openrouter-work-accounting-v1","projectionSpecDigest":"sha256:194039000c88208dfd3424ac8e0d4092a0c53a7dd5dc2d81a685527afa598410","rootContractDigest":"sha256:01d52a695e88694768973f3590c0c13eb5acd8070fbed32de8ad01e460c41135","scheduleDigest":"sha256:523e8950e699703a43de04242e19f50f74d4b498e4b0da0d2248ada8baa74346","schemaVersion":1}
