{"accountingStateDigest":"sha256:399631b871cec8ef1338f6b4dfda2ff6b59207b236eeaebca213b77204f654bb","completedTransitions":[{"accountingStateDigest":"sha256:766aab95ae1d88a757afce0077e89038041fe98945db5785ea8b71d598333dd6","builderHandoffDigest":"sha256:e4d03a9e243760e883982f390a0a18eaedd76c099b4927fe42c7818f1fa39f0f","builderResultDigest":"sha256:ddf585ba6a0040c87d19654d2b2e8996c429b1c5c400bfe4bca8678c89b6d065","ledgerOrdinal":3,"publicationManifestDigest":"sha256:51878b100d03cc408c233f31ff37f92587aaeba6e3f3dcc6976df2e0543bc1fd","subjectTransactionId":"c70e1829a7c6a2a8cb8cfc2383f8abf825ac5ea6","submissionInputDigest":"sha256:2ddd31b86fc71d6c8e62563bdee8210a6da58bf7cfcef67af5abbb2ab9362b67","topologyAlignmentDigest":"sha256:b75bbbe9479a65f1946bc2c68ea86e86b7f41cc54f4e19413f7def0b54cc9475","workBundleDigest":"sha256:bd0f8dc8c2df4bf52fc854bf38fb096559e87f06995102e6c44ee27ea6f28586"},{"accountingStateDigest":"sha256:5fe23d4603ddbd70bda515c8f87567ae2edcb332789958ff218fc629b083dead","builderHandoffDigest":"sha256:d95b796d29f3ebfa5c893c89716582297466f59a736d720fbc886c0f65c9f350","builderResultDigest":"sha256:e922d6388eef15e54f2dfd427784d930a831d7d43ebe6e05ddcb1b94581c04c9","ledgerOrdinal":4,"publicationManifestDigest":"sha256:09b637110847559cf0d8fa1d2a429fbfc24578bc93588e13aad56f960698371a","subjectTransactionId":"f236017c62c67ce4218c1f81ea34134f0954b556","submissionInputDigest":"sha256:392e697c9461e9b200de54b8ee01d83e02c8a4be808f9476e61f01559630e527","topologyAlignmentDigest":"sha256:b895bca3caeec45f724932b4a38ee02847015ef8e51c9fb535287c849bd5c6dd","workBundleDigest":"sha256:92a4cf87daaba092c7039aa48f3fb7fd272dccc50e99a5600f4880fd74c5fca1"},{"accountingStateDigest":"sha256:14d57e5d25ffce02309281e49955172e6ca136c529d58e4d2fd9344cdd45408c","builderHandoffDigest":"sha256:14b3f4a745cb0351f46202bf91bfd0d740fc74cd7c2b686538bef555a99f1331","builderResultDigest":"sha256:244b495423e70f5c46aed593c8a759782e1bc9344eb4f7e296ae009da0dcb806","ledgerOrdinal":5,"publicationManifestDigest":"sha256:a3f4d3ef8e92b7f7df9d079c13a618dadfe8bc527eda35a703e63c2c71c42bed","subjectTransactionId":"14889884ae6ac1f80cc56485e7acf1b0b2cb6ae9","submissionInputDigest":"sha256:ab83a33f5db6e0c4999fa72e6624a6902af589f4227e3cc9658327ca104b8f13","topologyAlignmentDigest":"sha256:338c3d2183c3997c38e732578552b0a4e01206c7b08dd536d74820a9c24b8f7b","workBundleDigest":"sha256:aa9f45e263e3b958a098327238f436e8cc3262524bda1905acc26d0a91f8b3f4"},{"accountingStateDigest":"sha256:adcd0251de8e2a4cb1676ccdf88f42a823e9a4220dd976578b83e2bb98231ade","builderHandoffDigest":"sha256:bc731885fee094b2edf981f6ee180555b18cfbc27b158e3b3853e689643721d8","builderResultDigest":"sha256:f37c561ee3313962f3898ac93029735c369873e41fe1ba48575b1e6af243d72c","ledgerOrdinal":9,"publicationManifestDigest":"sha256:129d2b56e3bba7769fa72a7ff338eb3fee9162b6cd11c616b3e9eed05c2c9935","subjectTransactionId":"e3c1036ca607539a5ebcddf3058e6014ac5c1cd9","submissionInputDigest":"sha256:22868c2aa767eb08ed2ecbb4826ef3b26024e35278caaece6bbaa86c9c598de6","topologyAlignmentDigest":"sha256:7c1e14de900e28c062f90a9c75c6eb71bc50da29e8d3a4104485f53f38e4ea24","workBundleDigest":"sha256:33ddd5862e38065b8f0f6b352fbd540cb126203a3974e6d50f167c00ee459dbe"},{"accountingStateDigest":"sha256:399631b871cec8ef1338f6b4dfda2ff6b59207b236eeaebca213b77204f654bb","builderHandoffDigest":"sha256:188aa9b21df2b6f383394d63289a6be6c6220bcd150b05fb9421403794a5979f","builderResultDigest":"sha256:c1ff4fd67a74f08fed6be415694aabef94f031ab38c70779b63da906a9bfd10a","ledgerOrdinal":10,"publicationManifestDigest":"sha256:78c31f449cb511d71d672bfe9b5434dfff6510b3f5c5139abfd779855c504850","subjectTransactionId":"d2506be78c46f1799e9b54cfcb6eee17b984f0f1","submissionInputDigest":"sha256:a17b76a9fc8441b0f527c062e13b7252a0881326a3667780ad7ff15a1360e7a7","topologyAlignmentDigest":"sha256:84a7ba5588e4f6cc526630395e6f4d2aa50f652a266925e4629b6c07faa3647c","workBundleDigest":"sha256:a41e587f66810c33f3a76a88209468c13f890b91ca166a0fc0bd119eb24ae4d6"}],"formedKnowledgeStateDigest":"sha256:715b96858ea3eb29f12f834e559b6137e1c244a2ee66b084610640214025263f","pendingTransition":{"afterKnowledgeStateDigest":"sha256:715b96858ea3eb29f12f834e559b6137e1c244a2ee66b084610640214025263f","beforeKnowledgeStateDigest":"sha256:5feb4c65a56314a89dc7c2394fa99a7d680a1d256170a7b9c1e34aed105e2242","builderHandoffDigest":"sha256:0360f89f1fccb3cc19af05265615fdf4e714000338b900ee0d9fbbf22fabcad6","builderResultDigest":"sha256:57d04ee44f90ebb797781808092c378dadd3b481522308f72bc0f8e4203306d9","claimDigest":"sha256:c08a81d0c67484bdc2ecc24d387bad0ca501061ebe982087ddb7ea894f3b5433","ledgerOrdinal":11,"nextAccountingStateDigest":null,"nextScheduleDigest":null,"publicationManifestDigest":null,"stage":"awaiting-work","subjectTransactionId":"e2bbc1e210e496b3c834e658820fc90287f3b2c0","submissionInputDigest":"sha256:3aab72e446e78bf462e513f9982a15617e33100ddc3690b73256303aa3a28f4c","topologyAlignmentDigest":"sha256:a033d0a35bf06170326dcb581aebe4a2faa64e61fe49b4e58ca89c9c735f8789","workBundleDigest":null},"phase":"awaiting-work","pipelineStateDigest":"sha256:5519c60d8d20585ddd20f6b030281fac762fc0c4f75f33c5d507be97010733a4","problemId":"bssc-sum-capacity","projectionId":"openrouter-work-accounting-v1","projectionSpecDigest":"sha256:194039000c88208dfd3424ac8e0d4092a0c53a7dd5dc2d81a685527afa598410","rootContractDigest":"sha256:01d52a695e88694768973f3590c0c13eb5acd8070fbed32de8ad01e460c41135","scheduleDigest":"sha256:f3dba7b3d9af4498f9cb701e1810bc0a906f90f487a35ac1b3b0d413493c172f","schemaVersion":1}
